{
  "version": "2.0.0",
  "area": "pescoco",
  "intake": {
    "symptoms": [
      { "id": "dor_cervical", "label": "Dor cervical", "aliases": ["dor no pescoço"], "weights": 1.0 },
      { "id": "linfonodo_cervical_aumentado", "label": "Íngua / linfonodo aumentado", "aliases": ["caroço no pescoço"], "weights": 1.0 },
      { "id": "febre", "label": "Febre", "aliases": [], "weights": 0.8 },
      { "id": "rigidez_cervical", "label": "Rigidez/dor cervical", "aliases": ["pescoço duro"], "weights": 1.2 }
    ],
    "modifiers": [
      { "id": "duracao_dias", "type": "number", "unit": "d" }
    ]
  },
  "dx": [
    {
      "id": "linfadenopatia_infecciosa",
      "label": "Linfadenopatia infecciosa",
      "pretest": 0.08,
      "criteria": [
        { "if": ["linfonodo_cervical_aumentado"], "lr+": 2.0 },
        { "if": ["febre"], "lr+": 1.3 }
      ],
      "heuristics": [],
      "red_flags": []
    }
  ],
  "profiles": {},
  "via_atendimento": {}
}
